{
  "id": "example.command.wait",
  "version": "2026-04-09",
  "entryStepId": "validate_input",
  "steps": {
    "validate_input": {
      "id": "validate_input",
      "type": "PROCESS",
      "subtype": "RULES",
      "artefactId": "process.validate",
      "nextStepId": "map_validation",
      "contract": {
        "input": {
          "ref": "$.context.input"
        },
        "output": {
          "ref": "$.context.checks.validation"
        }
      }
    },
    "map_validation": {
      "id": "map_validation",
      "type": "PROCESS",
      "subtype": "MAPPINGS",
      "artefactId": "process.mapValidation",
      "nextStepId": "route_validation",
      "contract": {
        "input": {
          "ref": "$.context.checks.validation"
        },
        "output": {
          "ref": "$.context.facts.validation"
        }
      }
    },
    "route_validation": {
      "id": "route_validation",
      "type": "CONTROL",
      "subtype": "ROUTE",
      "factRef": "$.context.facts.validation.ready",
      "cases": {
        "true": "send_command",
        "false": "finish_fail"
      },
      "defaultNextStepId": "finish_fail"
    },
    "send_command": {
      "id": "send_command",
      "type": "EFFECT",
      "subtype": "COMMAND",
      "operationId": "remote.submit",
      "inputRef": "$.context.input",
      "nextStepId": "wait_response",
      "onErrorStepId": "finish_fail"
    },
    "wait_response": {
      "id": "wait_response",
      "type": "WAIT",
      "subtype": "MESSAGE",
      "sourceStepId": "send_command",
      "nextStepId": "finish_complete",
      "onErrorStepId": "finish_fail",
      "onTimeoutStepId": "finish_timeout"
    },
    "finish_complete": {
      "id": "finish_complete",
      "type": "TERMINAL",
      "subtype": "COMPLETE",
      "result": {
        "status": "COMPLETE",
        "outcome": "COMMAND_SUCCEEDED"
      }
    },
    "finish_timeout": {
      "id": "finish_timeout",
      "type": "TERMINAL",
      "subtype": "FAIL",
      "result": {
        "status": "FAIL",
        "outcome": "COMMAND_TIMEOUT"
      }
    },
    "finish_fail": {
      "id": "finish_fail",
      "type": "TERMINAL",
      "subtype": "FAIL",
      "result": {
        "status": "FAIL",
        "outcome": "COMMAND_FAILED"
      }
    }
  }
}
